<?xml version="1.0" encoding="iso-8859-1"?>
<!DOCTYPE QueryObject SYSTEM "QueryObject.dtd">
<QueryObject
	SurrId="0414585975.tband.0002"
	IsRemoteAccessible="False"
	SqlDialect="SQLStandard"
	SuperClass="QueryObject"
	SqlTextModified="False"
	ChildMostDataObject="Attribute"
	DistinctRowsOnly="False"
	DeploySecurityInfo="False"
	DTDVersion="05.05.12"
	>
	<RuntimeSql><![CDATA[SELECT Attribute.AttrName AS AttrName, Attribute.Persistent AS Persistent, Attribute.ValueRequired AS ValueRequired, Attribute.DataType AS DataType, Attribute.AttrSize AS AttrSize, Attribute.Caption AS Caption, Derivation.Formula AS Formula, Attribute.Formula_Cnt AS Formula_Cnt, Attribute.RepositoryName AS RepositoryName, Attribute.DataObjectName AS DataObjectName FROM <dbschema>.Attribute Attribute, <dbschema>.Derivation Derivation  WHERE Derivation.RepositoryName = Attribute.RepositoryName  AND Derivation.DataObjectName = Attribute.DataObjectName  AND Derivation.AttrName = Attribute.AttrName  AND  Attribute.Formula_Cnt > 0   ORDER BY Attribute.AttrName Asc]]></RuntimeSql>
	<Where><![CDATA[Attribute.Formula_Cnt > 0]]></Where>
	<OrderBy>
	<OrderByAttribute
		Name="Attribute.AttrName"
		Direction="Ascending"
	/>
	</OrderBy>
	<Having><![CDATA[]]></Having>

	<DataObjects>
		<DataObject
			DataObjectName="Attribute"
			Alias="Attribute"
		/>

		<DataObject
			DataObjectName="Derivation"
			Alias="Derivation"
		/>

	</DataObjects>
	<Attributes>
		<Attribute
			Name="AttrName"
			Alias="AttrName"
			AggregationType="None"
			SourceDataObject="Attribute"
			Persistent="True"
		/>

		<Attribute
			Name="Persistent"
			Alias="Persistent"
			AggregationType="None"
			SourceDataObject="Attribute"
			Persistent="True"
		/>

		<Attribute
			Name="ValueRequired"
			Alias="ValueRequired"
			AggregationType="None"
			SourceDataObject="Attribute"
			Persistent="True"
		/>

		<Attribute
			Name="DataType"
			Alias="DataType"
			AggregationType="None"
			SourceDataObject="Attribute"
			Persistent="True"
		/>

		<Attribute
			Name="AttrSize"
			Alias="AttrSize"
			AggregationType="None"
			SourceDataObject="Attribute"
			Persistent="True"
			>
			<Caption><![CDATA[]]></Caption>
		</Attribute>

		<Attribute
			Name="Caption"
			Alias="Caption"
			AggregationType="None"
			SourceDataObject="Attribute"
			Persistent="True"
		/>

		<Attribute
			Name="Formula"
			Alias="Formula"
			AggregationType="None"
			SourceDataObject="Derivation"
			Persistent="True"
		/>

		<Attribute
			Name="Formula_Cnt"
			Alias="Formula_Cnt"
			AggregationType="None"
			SourceDataObject="Attribute"
			Persistent="True"
		/>

		<Attribute
			Name="RepositoryName"
			Alias="RepositoryName"
			AggregationType="None"
			SourceDataObject="Attribute"
			Persistent="True"
		/>

		<Attribute
			Name="DataObjectName"
			Alias="DataObjectName"
			AggregationType="None"
			SourceDataObject="Attribute"
			Persistent="True"
		/>

	</Attributes>
	<Joins
		LeftDataObject="Derivation"
		RightDataObject="ATTRIBUTE"
		JoinType="Equal"
		>
		<ColumnSet
			LeftAttribute="Derivation.RepositoryName"
			RightAttribute="Attribute.RepositoryName"
		/>
		<ColumnSet
			LeftAttribute="Derivation.DataObjectName"
			RightAttribute="Attribute.DataObjectName"
		/>
		<ColumnSet
			LeftAttribute="Derivation.AttrName"
			RightAttribute="Attribute.AttrName"
		/>
	</Joins>

	<RelsToParentDataObjects>
		<RelToParentDO
			RelToParentDO="DataObject(DataObject)-Attributes(Attribute)"
		>
			<Aliases>
				<Alias
					Name="Attribute"
				>
					<AttributePairs>
					<AttributePair
							ParentAttribute="RepositoryName"
							ChildAttribute="RepositoryName"
							/>
					<AttributePair
							ParentAttribute="DataObjectName"
							ChildAttribute="DataObjectName"
							/>
					</AttributePairs>
				</Alias>
			</Aliases>
		</RelToParentDO>
	</RelsToParentDataObjects>

	<RelsToChildDataObjects>
		<RelToChildDO
			RelToChildDO="DerivationAttr(Attribute)-Derivations(Derivation)"
		>
			<Aliases>
				<Alias
					Name="Attribute"
				>
					<AttributePairs>
				<AttributePair
							ParentAttribute="RepositoryName"
							ChildAttribute="RepositoryName"
							/>
				<AttributePair
							ParentAttribute="DataObjectName"
							ChildAttribute="DataObjectName"
							/>
				<AttributePair
							ParentAttribute="AttrName"
							ChildAttribute="AttrName"
							/>
					</AttributePairs>
				</Alias>
			</Aliases>
		</RelToChildDO>
		<RelToChildDO
			RelToChildDO="Attribute(Attribute)-Derivation(Derivation)"
		>
			<Aliases>
				<Alias
					Name="Attribute"
				>
					<AttributePairs>
				<AttributePair
							ParentAttribute="RepositoryName"
							ChildAttribute="RepositoryName"
							/>
				<AttributePair
							ParentAttribute="DataObjectName"
							ChildAttribute="SourceDataObject"
							/>
				<AttributePair
							ParentAttribute="AttrName"
							ChildAttribute="AttrName"
							/>
					</AttributePairs>
				</Alias>
			</Aliases>
		</RelToChildDO>
		<RelToChildDO
			RelToChildDO="Attribute1(Attribute)-IndexAttr(IndexAttr)"
		>
			<Aliases>
				<Alias
					Name="Attribute"
				>
					<AttributePairs>
				<AttributePair
							ParentAttribute="RepositoryName"
							ChildAttribute="RepositoryName"
							/>
				<AttributePair
							ParentAttribute="DataObjectName"
							ChildAttribute="DataObjectName"
							/>
				<AttributePair
							ParentAttribute="AttrName"
							ChildAttribute="IndexAttrName"
							/>
					</AttributePairs>
				</Alias>
			</Aliases>
		</RelToChildDO>
		<RelToChildDO
			RelToChildDO="ValidationAttr(Attribute)-Validations(Validation)"
		>
			<Aliases>
				<Alias
					Name="Attribute"
				>
					<AttributePairs>
				<AttributePair
							ParentAttribute="RepositoryName"
							ChildAttribute="RepositoryName"
							/>
				<AttributePair
							ParentAttribute="DataObjectName"
							ChildAttribute="DataObjectName"
							/>
				<AttributePair
							ParentAttribute="AttrName"
							ChildAttribute="AttrName"
							/>
					</AttributePairs>
				</Alias>
			</Aliases>
		</RelToChildDO>
		<RelToChildDO
			RelToChildDO="Attribute2(Attribute)-Validation(Validation)"
		>
			<Aliases>
				<Alias
					Name="Attribute"
				>
					<AttributePairs>
				<AttributePair
							ParentAttribute="RepositoryName"
							ChildAttribute="RepositoryName"
							/>
				<AttributePair
							ParentAttribute="DataObjectName"
							ChildAttribute="CodedValueList"
							/>
				<AttributePair
							ParentAttribute="AttrName"
							ChildAttribute="AttrName"
							/>
					</AttributePairs>
				</Alias>
			</Aliases>
		</RelToChildDO>
		<RelToChildDO
			RelToChildDO="SourceAttribute(Attribute)-AttrObjectMapper(AttrObjectMapper)"
		>
			<Aliases>
				<Alias
					Name="Attribute"
				>
					<AttributePairs>
				<AttributePair
							ParentAttribute="RepositoryName"
							ChildAttribute="SourceRepositoryName"
							/>
				<AttributePair
							ParentAttribute="DataObjectName"
							ChildAttribute="SourceDataObjectName"
							/>
				<AttributePair
							ParentAttribute="AttrName"
							ChildAttribute="SourceAttrName"
							/>
					</AttributePairs>
				</Alias>
			</Aliases>
		</RelToChildDO>
		<RelToChildDO
			RelToChildDO="TargetAttribute(Attribute)-AttrObjectMapper_1(AttrObjectMapper)"
		>
			<Aliases>
				<Alias
					Name="Attribute"
				>
					<AttributePairs>
				<AttributePair
							ParentAttribute="RepositoryName"
							ChildAttribute="TargetRepositoryName"
							/>
				<AttributePair
							ParentAttribute="DataObjectName"
							ChildAttribute="TargetDataObjectName"
							/>
				<AttributePair
							ParentAttribute="AttrName"
							ChildAttribute="TargetAttrName"
							/>
					</AttributePairs>
				</Alias>
			</Aliases>
		</RelToChildDO>
	</RelsToChildDataObjects>

	<PickSupportedRels>
		<PickSupportedRel
			PickSupportedRel="DerivationAttr(Attribute)-Derivations(Derivation)"
		/>
		<PickSupportedRel
			PickSupportedRel="Attribute(Attribute)-Derivation(Derivation)"
		/>
		<PickSupportedRel
			PickSupportedRel="Attribute1(Attribute)-IndexAttr(IndexAttr)"
		/>
		<PickSupportedRel
			PickSupportedRel="ValidationAttr(Attribute)-Validations(Validation)"
		/>
		<PickSupportedRel
			PickSupportedRel="Attribute2(Attribute)-Validation(Validation)"
		/>
		<PickSupportedRel
			PickSupportedRel="SourceAttribute(Attribute)-AttrObjectMapper(AttrObjectMapper)"
		/>
		<PickSupportedRel
			PickSupportedRel="TargetAttribute(Attribute)-AttrObjectMapper_1(AttrObjectMapper)"
		/>
	</PickSupportedRels >

</QueryObject>
